{
  "$ref": "#/definitions/pages",
  "definitions": {
    "pages": {
      "type": "object",
      "properties": {
        "title": {
          "type": "string"
        },
        "description": {
          "type": "string"
        },
        "bodyClass": {
          "type": "string"
        },
        "hero": {},
        "sections": {
          "type": "object",
          "additionalProperties": {}
        },
        "roles": {},
        "contact": {},
        "ui": {},
        "$schema": {
          "type": "string"
        }
      },
      "required": [
        "title",
        "description"
      ],
      "additionalProperties": true
    }
  },
  "$schema": "http://json-schema.org/draft-07/schema#"
}