{
    "title": "Anton Meier Ebsen Jørgensen – Ressourcer & Downloads",
    "description": "Gratis ressourcer og downloads: Excel-skabeloner, kode, noter og guides.",
    "hero": {
        "eyebrow": "Ressourcer",
        "title": "Downloads & templates",
        "text": "Små, praktiske ressourcer jeg selv bruger: skabeloner, cheat sheets og eksempler. Alt er lavet til at være plug-and-play.",
        "pills": [
            "Excel",
            "VBA",
            "Python",
            "SAS",
            "GAMS"
        ],
        "btns": {
            "download": "Se downloads",
            "stats": "Se kursusstatistik",
            "ask": "Spørg om noget specifikt"
        }
    },
    "sections": {
        "note": {
            "title": "Note",
            "text1": "Nogle filer kan være “sanitized” (fjernet data/navne) pga. kursus/fortrolighed.",
            "text2": "Har du et konkret behov? Skriv — jeg kan ofte lave en skabelon, der passer."
        },
        "downloads": {
            "title": "Downloads",
            "text": "Placér filer i mappen assets/downloads/ og link dem her."
        },
        "cta": {
            "title": "Vil du have noget specifikt?",
            "text": "Hvis du fortæller mig dit format (Excel/Python/SAS) og mål (fx forecasting, dashboards, data-cleaning), kan jeg foreslå en template-struktur, der passer.",
            "contact": "Kontakt",
            "services": "Se services"
        }
    }
}