{
    "title": "Anton Meier Ebsen Jørgensen – Milepæle",
    "description": "Timeline med milepæle inden for økonomi, data, undervisning, projekter og omtale.",
    "hero": {
        "eyebrow": "Milepæle",
        "title": "Min timeline",
        "text": "Et hurtigt overblik over udvalgte milepæle inden for studier, projekter, undervisning og omtale. Kort, konkret, og opdateres løbende.",
        "filters": {
            "all": "Alle",
            "professional": "Fagligt",
            "teaching": "Undervisning",
            "projects": "Projekter",
            "media": "Omtale",
            "training": "Træning",
            "travel": "Rejser"
        }
    },
    "sections": {
        "usage": {
            "title": "Hvordan jeg bruger den",
            "list": [
                "År / dato",
                "Hvad skete der?",
                "Resultat (tal/impact hvis muligt)",
                "Link til case, artikel eller repo"
            ]
        },
        "list": {
            "title": "Udvalgte milepæle"
        },
        "cta": {
            "title": "Vil du foreslå en milepæl?",
            "text": "Hvis du mener der mangler noget (fx en publikation, et projekt eller en omtale), så skriv endelig.",
            "btn": "Kontakt",
            "mail": "Send mail"
        }
    }
}