{
    "title": "Bucket List | Anton Ebsen",
    "description": "Min liste over m√•l og dr√∏mme.",
    "hero": {
        "title": "The Bucket List üèÜ",
        "text": "Livet er kort. Her er hvad jeg arbejder hen imod."
    },
    "sections": {
        "doing": {
            "title": "Active Quests (Doing)"
        },
        "done": {
            "title": "Trophy Room (Completed)"
        },
        "todo": {
            "title": "The Vault (To-Do)"
        }
    }
}