{
    "title": "Bucket List | Anton Ebsen",
    "description": "My list of goals and dreams.",
    "hero": {
        "title": "The Bucket List üèÜ",
        "text": "Life is short. Here's what I'm working towards."
    },
    "sections": {
        "doing": {
            "title": "Active Quests (Doing)"
        },
        "done": {
            "title": "Trophy Room (Completed)"
        },
        "todo": {
            "title": "The Vault (To-Do)"
        }
    }
}