{
    "title": "Anton Meier Ebsen Jørgensen – Meilensteine",
    "description": "Timeline mit Meilensteinen in Wirtschaft, Daten, Lehre, Projekten und Medienberichterstattung.",
    "hero": {
        "eyebrow": "Meilensteine",
        "title": "Meine Zeitreise",
        "text": "Ein schneller Überblick über ausgewählte Meilensteine in Studium, Projekten, Lehre und Medien. Kurz, konkret und regelmäßig aktualisiert.",
        "filters": {
            "all": "Alle",
            "professional": "Beruflich",
            "teaching": "Lehre",
            "projects": "Projekte",
            "media": "Medien",
            "training": "Training",
            "travel": "Reise"
        }
    },
    "sections": {
        "usage": {
            "title": "Wie ich sie nutze",
            "list": [
                "Jahr / Datum",
                "Was ist passiert?",
                "Ergebnis (Statistiken/Einfluss wenn möglich)",
                "Link zum Case, Artikel oder Repo"
            ]
        },
        "list": {
            "title": "Ausgewählte Meilensteine"
        },
        "cta": {
            "title": "Möchten Sie einen Meilenstein vorschlagen?",
            "text": "Wenn Sie glauben, dass etwas fehlt (z. B. eine Publikation, ein Projekt oder eine Erwähnung), melden Sie sich bitte.",
            "btn": "Kontakt",
            "mail": "E-Mail senden"
        }
    }
}