{
    "title": "Anton Meier Ebsen Jørgensen – Milestones",
    "description": "Timeline with milestones in economics, data, teaching, projects, and media coverage.",
    "hero": {
        "eyebrow": "Milestones",
        "title": "My Timeline",
        "text": "A quick overview of selected milestones within studies, projects, teaching, and media coverage. Brief, concrete, and updated regularly.",
        "filters": {
            "all": "All",
            "professional": "Professional",
            "teaching": "Teaching",
            "projects": "Projects",
            "media": "Media",
            "training": "Training",
            "travel": "Travel"
        }
    },
    "sections": {
        "usage": {
            "title": "How I Use It",
            "list": [
                "Year / Date",
                "What happened?",
                "Result (stats/impact if possible)",
                "Link to case, article, or repo"
            ]
        },
        "list": {
            "title": "Selected Milestones"
        },
        "cta": {
            "title": "Want to suggest a milestone?",
            "text": "If you think something is missing (e.g., a publication, a project, or mention), please reach out.",
            "btn": "Contact",
            "mail": "Send email"
        }
    }
}