{
    "title": "Anton's AI Assistant",
    "description": "Ask me questions about Anton's CV, projects, blog posts, and experience.",
    "bodyClass": "chat-page",
    "hero": {
        "eyebrow": "AI Powered Analytics",
        "back": "Back to Home",
        "about": "About this AI"
    },
    "ui": {
        "intro": "Hi! I'm the full-screen AI. I can analyze the portfolio and even <strong>generate charts</strong> from the data. Give it a try!",
        "placeholder": "Try: 'Visualize your experience timeline'...",
        "disclaimer": "Powered by Google Gemini Â· May produce inaccuracies",
        "prompts": [
            "ðŸ“Š Graph Anton's skills",
            "ðŸ’¼ Summarize Anton's experience",
            "ðŸ“‹ Analyze Job Match"
        ],
        "status": {
            "online": "ONLINE",
            "model": "MODEL: GEMINI 2.5 FLASH",
            "secure": "SECURE CONN",
            "latency": "LATENCY: 24ms"
        }
    }
}