{
    "title": "Anton's AI Assistent",
    "description": "Stil mig spÃ¸rgsmÃ¥l om Antons CV, projekter, blogindlÃ¦g og erfaring.",
    "bodyClass": "chat-page",
    "hero": {
        "eyebrow": "AI Drevet Analyse",
        "back": "Tilbage til forsiden",
        "about": "Om denne AI"
    },
    "ui": {
        "intro": "Hej! Jeg er den store udgave af Antons AI. Jeg kan analysere hele portfolioen og endda <strong>lave grafer</strong> over dataene. PrÃ¸v det!",
        "placeholder": "Stil mig et spÃ¸rgsmÃ¥l...",
        "disclaimer": "Drevet af Google Gemini Â· Kan lave fejl",
        "prompts": [
            "ðŸ“Š Vis mig en graf over Antons skills",
            "ðŸ’¼ Opsummer Antons erfaring",
            "ðŸ“‹ AnalysÃ©r Jobopslag"
        ],
        "status": {
            "online": "ONLINE",
            "model": "MODEL: GEMINI 2.5 FLASH",
            "secure": "SECURE CONN",
            "latency": "LATENCY: 24ms"
        }
    }
}