{
    "title": "Anton Meier Ebsen Jørgensen – Profil / Om mig",
    "description": "Kandidatstuderende i økonomi ved Københavns Universitet. Økonomisk historie, demografi, anvendt økonometri og undervisning. Forventet afslutning januar 2027.",
    "bodyClass": "about-page",
    "hero": {
        "eyebrow": "Profil / Om mig",
        "title": "Økonomisk historie, data og anvendt økonometri",
        "lead": "Jeg er <strong>kandidatstuderende i økonomi ved Københavns Universitet</strong> med interesse for økonomisk historie, demografi, institutioner, teknologi og ulighed. Jeg arbejder med historiske paneldata og skriver fælles speciale om slaveriet på St. Croix med Paul Sharp som vejleder. Jeg forventer at afslutte kandidatuddannelsen i <strong>januar 2027</strong>. Min baggrund omfatter også makroøkonomi og undervisning i Excel og VBA hos Djøf.",
        "pills": [
            "Økonomisk historie",
            "Historisk demografi",
            "Anvendt økonometri",
            "Historiske data",
            "Undervisning"
        ],
        "cta": [
            {
                "label": "Arbejdsstil",
                "url": "#arbejdsstil",
                "icon": "fa-solid fa-compass"
            },
            {
                "label": "Fokusområder",
                "url": "#focus",
                "icon": "fa-solid fa-bullseye",
                "variant": "ghost"
            },
            {
                "label": "Kontakt",
                "url": "#contact",
                "icon": "fa-solid fa-envelope",
                "variant": "ghost"
            }
        ],
        "quickFacts": {
            "title": "Hurtige facts",
            "facts": [
                {
                    "icon": "fa-solid fa-location-dot",
                    "text": "København"
                },
                {
                    "icon": "fa-solid fa-chart-line",
                    "text": "Interesser: institutioner, demografi, teknologi og ulighed"
                },
                {
                    "icon": "fa-solid fa-code",
                    "text": "Værktøjer: Python, SAS, GAMS + Excel/VBA"
                },
                {
                    "icon": "fa-solid fa-chalkboard-user",
                    "text": "Formidling: underviser (Excel/VBA) og bygger cases"
                }
            ]
        },
        "nav": {
            "title": "På siden",
            "links": [
                {
                    "label": "Fokusområder",
                    "url": "#focus"
                },
                {
                    "label": "Hvordan jeg arbejder",
                    "url": "#arbejdsstil"
                },
                {
                    "label": "Undervisning & formidling",
                    "url": "#teaching"
                },
                {
                    "label": "Uden for studiet",
                    "url": "#outside"
                },
                {
                    "label": "Kontakt",
                    "url": "#contact"
                }
            ]
        }
    },
    "sections": {
        "story": {
            "title": "Viljen til at modbevise",
            "text": "Min vej til at blive økonom har ikke været snorlige. Jeg har lært at vende skepsis til mod og modgang til målrettethed. Læs min personlige fortælling om rejsen fra epilepsi og specialklasse til cand.polit.",
            "cta": {
                "label": "Læs min historie",
                "url": "/modgang-og-maalrettethed"
            }
        },
        "focus": {
            "title": "Fokusområder",
            "items": [
                {
                    "title": "Økonomisk historie og demografi",
                    "text": "Min demografiopgave undersøger ægteskab og fertilitet i det nittende århundredes Preussen. Mit igangværende fælles speciale handler om slaveriets økonomiske historie på St. Croix."
                },
                {
                    "title": "Anvendt økonometri",
                    "text": "Paneldata, difference-in-differences og kritisk vurdering af identifikation. Jeg lægger vægt på parallelle trends, timing, robusthed og alternative forklaringer."
                },
                {
                    "title": "Institutioner, teknologi og ulighed",
                    "text": "Jeg er interesseret i, hvordan institutioner og nye teknologier former ulige økonomiske og sundhedsmæssige udfald. Det er interesser for fremtidig forskning, ikke afsluttede studier."
                },
                {
                    "title": "Data & tooling",
                    "text": "Jeg bygger små pipelines og templates: fra data cleaning til output, så det kan genbruges og ikke kun virker én gang."
                }
            ]
        },
        "workingStyle": {
            "title": "Hvordan jeg arbejder",
            "intro": "Min standard-arbejdsgang (lidt kedelig — men det er præcis derfor den virker):",
            "steps": [
                "1) Afklar mål: hvad skal beslutningstager/læser kunne gøre bagefter?",
                "2) Dokumentér data: kilder, definitioner, enheder, missing/outliers, transformationer.",
                "3) Vælg metode: simpelt først, derefter “mere fancy” hvis det giver noget reelt.",
                "4) Checks: sanity checks, robusthed, alternative specifikationer, edge cases.",
                "5) Formidling: konklusioner, begrænsninger og “hvad betyder det i praksis?”"
            ],
            "cta": [
                {
                    "label": "Se portefølje",
                    "url": "/portfolio",
                    "icon": "fa-solid fa-folder-open",
                    "variant": "ghost"
                },
                {
                    "label": "Se ressourcer",
                    "url": "/resources",
                    "icon": "fa-solid fa-download"
                }
            ]
        },
        "teaching": {
            "title": "Undervisning & formidling",
            "intro": "Jeg har erfaring med at undervise i Excel/VBA og kan lide at gøre ting konkrete: cases, øvelser, “hvorfor” bag funktioner og små genveje der gør en stor forskel.",
            "styles": [
                {
                    "title": "Min undervisningsstil",
                    "points": [
                        "Struktur først (mål → løsning → kvalitetstjek)",
                        "Hands-on: hellere én god case end 30 slides",
                        "Templates der kan genbruges"
                    ]
                },
                {
                    "title": "Hvad jeg typisk hjælper med",
                    "points": [
                        "Excel-modeller, dashboards og logik",
                        "Data cleaning og reproducérbare workflows",
                        "Små scripts og automatisering"
                    ]
                }
            ]
        },
        "outside": {
            "title": "Uden for studiet",
            "text": "Jeg holder af rutiner og progression — både i træning og i projekter. Det lyder måske lidt “kontor-nørdet”, men det er ærligt talt ret tilfredsstillende at se kurver gå den rigtige vej.",
            "cta": [
                {
                    "label": "Træningsindlæg",
                    "url": "/blog#cat-traening",
                    "icon": "fa-solid fa-dumbbell",
                    "variant": "ghost"
                },
                {
                    "label": "Rejser",
                    "url": "/blog#cat-rejser",
                    "icon": "fa-solid fa-person-hiking",
                    "variant": "ghost"
                }
            ]
        },
        "contact": {
            "title": "Kontakt",
            "text": "Hvis du vil sparre om et projekt, en case eller et samarbejde, så skriv endelig.",
            "cta": [
                {
                    "label": "Send mail",
                    "url": "mailto:anton.ebsen@gmail.com",
                    "icon": "fa-solid fa-envelope"
                },
                {
                    "label": "Kontakt-side",
                    "url": "/contact",
                    "icon": "fa-solid fa-message",
                    "variant": "ghost"
                },
                {
                    "label": "Tilbage til CV",
                    "url": "/cv",
                    "icon": "fa-solid fa-file-lines",
                    "variant": "ghost"
                }
            ]
        }
    }
}
